{
  "$schema": "https://json-schema.org/draft/2020-12/schema",
  "title": "Furina Engineering Factory Work Queue",
  "type": "object",
  "required": ["schemaVersion", "updatedAt", "stagingBaseSha", "items"],
  "properties": {
    "schemaVersion": {"const": 1},
    "updatedAt": {"type": "string", "format": "date-time"},
    "stagingBaseSha": {"type": "string", "pattern": "^[0-9a-f]{7,40}$", "description": "Released main SHA that staging was last rebased/reset from."},
    "lastIntegration": {
      "type": ["object", "null"],
      "properties": {
        "checkpointId": {"type": "string", "minLength": 3},
        "stagingSha": {"type": "string", "pattern": "^[0-9a-f]{7,40}$", "description": "Actual checkpoint commit SHA validated by MEDIUM CI; later queue-only bookkeeping may advance staging without invalidating this product validation."},
        "validatedAt": {"type": "string", "format": "date-time"},
        "status": {"enum": ["GREEN", "RED", "PENDING"]},
        "candidateIds": {"type": "array", "items": {"type": "string", "minLength": 3}}
      },
      "required": ["checkpointId", "stagingSha", "validatedAt", "status", "candidateIds"],
      "additionalProperties": true
    },
    "lastRelease": {
      "type": ["object", "null"],
      "properties": {
        "mainSha": {"type": "string", "pattern": "^[0-9a-f]{7,40}$"},
        "releasedAt": {"type": "string", "format": "date-time"},
        "candidateIds": {"type": "array", "items": {"type": "string", "minLength": 3}}
      },
      "required": ["mainSha", "releasedAt", "candidateIds"],
      "additionalProperties": true
    },
    "items": {
      "type": "array",
      "items": {
        "type": "object",
        "required": [
          "id", "createdAt", "shiftId", "title", "subsystem", "triageClass",
          "strategicTier", "autonomyClass", "status", "baseSha", "headSha",
          "validationTier", "evidenceLevel", "dependencies", "conflictsWith",
          "rollbackBoundary", "expectedMetric", "expectedDelta", "verificationWindow"
        ],
        "properties": {
          "id": {"type": "string", "minLength": 3},
          "createdAt": {"type": "string", "format": "date-time"},
          "shiftId": {"type": "string", "minLength": 3},
          "title": {"type": "string", "minLength": 3},
          "subsystem": {"type": "string", "minLength": 2},
          "triageClass": {"enum": ["T0_STOP_THE_LINE", "T1_CRITICAL_PATH", "T2_MAJOR", "T3_LOCAL", "T4_POLISH"]},
          "strategicTier": {"type": "string", "minLength": 2},
          "autonomyClass": {"enum": ["GREEN", "YELLOW", "RED"]},
          "status": {"enum": ["CANDIDATE", "INTEGRATED", "RELEASED", "BLOCKED_EVIDENCE", "BLOCKED_HUMAN", "QUARANTINED", "SUPERSEDED", "REJECTED"]},
          "baseSha": {"type": "string", "pattern": "^[0-9a-f]{7,40}$", "description": "Staging SHA immediately before implementation began."},
          "headSha": {"type": "string", "pattern": "^[0-9a-f]{7,40}$", "description": "Exact implementation subject SHA reviewed by Candidate Reviewer, captured before the queue bookkeeping commit that records this item."},
          "validationTier": {"enum": ["FAST", "MEDIUM", "FULL"]},
          "evidenceLevel": {"enum": ["STATIC", "CI", "BEHAVIORAL", "DEVICE"]},
          "dependencies": {"type": "array", "items": {"type": "string", "minLength": 3}},
          "conflictsWith": {"type": "array", "items": {"type": "string", "minLength": 3}},
          "rollbackBoundary": {"type": "string", "minLength": 3},
          "expectedMetric": {"type": "string", "minLength": 2},
          "expectedDelta": {"type": "string", "minLength": 2},
          "verificationWindow": {"type": "string", "minLength": 2},
          "notes": {"type": "string"}
        },
        "additionalProperties": true
      }
    }
  },
  "additionalProperties": true
}
